{
  "schema_version": "3.0",
  "source_schema_version": "2.0",
  "generated_at": "2026-10-19T04:07:25.093086+00:00",
  "expected_metrics": [
    "US10Y",
    "DXY",
    "VIX",
    "BTC",
    "ETH"
  ],
  "records": [
    {
      "metric_id": "US10Y",
      "canonical_name": "US 10-Year Treasury Yield",
      "category": "MACRO",
      "raw": {
        "value": 5.1,
        "unit": "%"
      },
      "normalized": {
        "value": 0.051,
        "unit": "DECIMAL",
        "precision": 8
      },
      "transformation": {
        "type": "PERCENT_TO_DECIMAL",
        "formula": "raw_value / 100",
        "deterministic": true
      },
      "provenance": {
        "ticker": "DGS10",
        "source": "FRED / Federal Reserve Board H.15",
        "source_type": "PRIMARY",
        "observed_at": "2026-10-15T00:00:00+00:00",
        "fetched_at": "2026-10-19T04:07:24.502093+00:00",
        "status": "FRESH",
        "error": null
      }
    },
    {
      "metric_id": "DXY",
      "canonical_name": "US Dollar Index",
      "category": "FX",
      "raw": {
        "value": 101.84,
        "unit": "INDEX"
      },
      "normalized": {
        "value": 101.84,
        "unit": "INDEX",
        "precision": 6
      },
      "transformation": {
        "type": "IDENTITY",
        "formula": "raw_value",
        "deterministic": true
      },
      "provenance": {
        "ticker": "DX-Y.NYB",
        "source": "Yahoo Finance via yfinance",
        "source_type": "PRIMARY",
        "observed_at": "2026-10-16T04:00:00+00:00",
        "fetched_at": "2026-10-19T04:07:24.784777+00:00",
        "status": "FRESH",
        "error": null
      }
    },
    {
      "metric_id": "VIX",
      "canonical_name": "CBOE Volatility Index",
      "category": "RISK",
      "raw": {
        "value": 19.99,
        "unit": "INDEX"
      },
      "normalized": {
        "value": 19.99,
        "unit": "INDEX",
        "precision": 6
      },
      "transformation": {
        "type": "IDENTITY",
        "formula": "raw_value",
        "deterministic": true
      },
      "provenance": {
        "ticker": "^VIX",
        "source": "Yahoo Finance via yfinance",
        "source_type": "PRIMARY",
        "observed_at": "2026-10-16T05:00:00+00:00",
        "fetched_at": "2026-10-19T04:07:24.885892+00:00",
        "status": "FRESH",
        "error": null
      }
    },
    {
      "metric_id": "BTC",
      "canonical_name": "Bitcoin",
      "category": "CRYPTO",
      "raw": {
        "value": 82437.2121,
        "unit": "USD"
      },
      "normalized": {
        "value": 82437.2121,
        "unit": "USD",
        "precision": 4
      },
      "transformation": {
        "type": "IDENTITY",
        "formula": "raw_value",
        "deterministic": true
      },
      "provenance": {
        "ticker": "BTC-USD",
        "source": "CoinGecko Public API",
        "source_type": "PRIMARY",
        "observed_at": "2026-10-19T04:05:50+00:00",
        "fetched_at": "2026-10-19T04:07:25.000086+00:00",
        "status": "FRESH",
        "error": null
      }
    },
    {
      "metric_id": "ETH",
      "canonical_name": "Ethereum",
      "category": "CRYPTO",
      "raw": {
        "value": 2419.691,
        "unit": "USD"
      },
      "normalized": {
        "value": 2419.691,
        "unit": "USD",
        "precision": 4
      },
      "transformation": {
        "type": "IDENTITY",
        "formula": "raw_value",
        "deterministic": true
      },
      "provenance": {
        "ticker": "ETH-USD",
        "source": "CoinGecko Public API",
        "source_type": "PRIMARY",
        "observed_at": "2026-10-19T04:05:50+00:00",
        "fetched_at": "2026-10-19T04:07:25.092579+00:00",
        "status": "FRESH",
        "error": null
      }
    }
  ]
}